{
  "$schema": "https://json-schema.org/draft/2020-12/schema",
  "$id": "https://ekd.invalid/schemas/p1-web-console-status-v1.schema.json",
  "title": "P1 web console status v1 DTO",
  "description": "ADR-0031 §4: the closed whitelist the read-only localhost console may send to the browser. Sensitive metadata (file_count, total_plaintext_bytes), identifiers, paths, keys and secrets are structurally impossible: no property accepts them. Null counts mean the source is unavailable, never 0.",
  "type": "object",
  "additionalProperties": false,
  "required": ["schema", "service", "head", "storage", "tasks", "report"],
  "properties": {
    "schema": {"const": "p1-web-console-status-v1"},
    "service": {
      "type": "object",
      "additionalProperties": false,
      "required": ["status", "version", "build", "started_at", "uptime_seconds"],
      "properties": {
        "status": {"enum": ["ok", "degraded"]},
        "version": {"type": "string", "minLength": 1, "maxLength": 64},
        "build": {"type": "string", "minLength": 1, "maxLength": 128},
        "started_at": {"type": "string", "pattern": "^\\d{4}-\\d{2}-\\d{2}T\\d{2}:\\d{2}:\\d{2}(\\.\\d{3}Z)?$"},
        "uptime_seconds": {"type": "integer", "minimum": 0}
      }
    },
    "head": {
      "type": "object",
      "additionalProperties": false,
      "required": ["present", "sequence", "created_at", "verdict", "checked_at"],
      "properties": {
        "present": {"type": "boolean"},
        "sequence": {"type": ["integer", "null"], "minimum": 0},
        "created_at": {"type": ["string", "null"], "pattern": "^\\d{4}-\\d{2}-\\d{2}T\\d{2}:\\d{2}:\\d{2}(\\.\\d{3}Z)?$"},
        "verdict": {
          "enum": [
            "verified",
            "not_checked",
            "signature_invalid",
            "device_unregistered",
            "rollback_detected",
            "fork_detected",
            "unreadable",
            "unknown"
          ]
        },
        "checked_at": {"type": "string", "pattern": "^\\d{4}-\\d{2}-\\d{2}T\\d{2}:\\d{2}:\\d{2}(\\.\\d{3}Z)?$"}
      }
    },
    "storage": {
      "type": "object",
      "additionalProperties": false,
      "required": ["object_count", "total_ciphertext_bytes", "observed_at"],
      "properties": {
        "object_count": {"type": ["integer", "null"], "minimum": 0},
        "total_ciphertext_bytes": {"type": ["integer", "null"], "minimum": 0},
        "observed_at": {"type": "string", "pattern": "^\\d{4}-\\d{2}-\\d{2}T\\d{2}:\\d{2}:\\d{2}(\\.\\d{3}Z)?$"}
      }
    },
    "tasks": {
      "type": "object",
      "additionalProperties": false,
      "required": ["items"],
      "properties": {
        "items": {
          "type": "array",
          "maxItems": 20,
          "items": {
            "type": "object",
            "additionalProperties": false,
            "required": ["kind", "status", "started_at", "completed_at", "duration_ms", "object_count", "total_ciphertext_bytes", "error_code"],
            "properties": {
              "kind": {"enum": ["snapshot", "restore"]},
              "status": {"enum": ["complete", "failed"]},
              "started_at": {"type": "string", "pattern": "^\\d{4}-\\d{2}-\\d{2}T\\d{2}:\\d{2}:\\d{2}(\\.\\d{3}Z)?$"},
              "completed_at": {"type": "string", "pattern": "^\\d{4}-\\d{2}-\\d{2}T\\d{2}:\\d{2}:\\d{2}(\\.\\d{3}Z)?$"},
              "duration_ms": {"type": "integer", "minimum": 0},
              "object_count": {"type": "integer", "minimum": 0},
              "total_ciphertext_bytes": {"type": "integer", "minimum": 0},
              "error_code": {"type": ["string", "null"], "pattern": "^[A-Z][A-Z0-9_]*$"}
            }
          }
        }
      }
    },
    "report": {
      "type": ["object", "null"],
      "additionalProperties": false,
      "required": ["schema_version", "verdict", "created_at", "object_count", "total_ciphertext_bytes"],
      "properties": {
        "schema_version": {"type": "string", "minLength": 1, "maxLength": 64},
        "verdict": {"type": "string", "minLength": 1, "maxLength": 32},
        "created_at": {"type": "string", "pattern": "^\\d{4}-\\d{2}-\\d{2}T\\d{2}:\\d{2}:\\d{2}(\\.\\d{3}Z)?$"},
        "object_count": {"type": "integer", "minimum": 0},
        "total_ciphertext_bytes": {"type": "integer", "minimum": 0}
      }
    }
  }
}
